{
  "schema": "dusk.intended-processes/v1",
  "id": "01a112fe-d1bd-704c-9bd1-2339a1c7e5f7",
  "time": "2026-10-06T09:15:39.512408216Z",
  "pid": "9840895173617753969",
  "device_id": "3f9c0e2a7b5d4c1e8a6f0b2d9e7c5a13",
  "installation_id": "a41e6c2f9b0d4e7a8c3f5b1d2e9a6c70",
  "campaign_id": null,
  "action_kind": "collect_facts",
  "principal": "twilight",
  "subject": "twilight",
  "created_at": "2026-10-06T09:15:39.511902330Z",
  "expires_at": "2026-10-06T09:21:39.511902330Z",
  "max_commands": 1,
  "default_shell_commands": 4
}
